{
  "$schema": "https://json-schema.org/draft/2020-12/schema",
  "$id": "https://raw.githubusercontent.com/portofcontext/agent-voyager-project/main/conformance/schema/test-case.schema.json",
  "title": "AVP Conformance Test Case (v0.1)",
  "description": "Language-agnostic test case format. Each SDK implements a thin harness (see HARNESS.md) that reads cases of this shape, runs them against its implementation, and asserts. Cases describe (a) the Commission the agent receives, (b) a deterministic script of model responses, tool outputs, and resolver outcomes, and (c) expectations over the emitted event trajectory.",
  "type": "object",
  "required": ["id", "title", "applies_to", "commission", "expectations"],
  "additionalProperties": false,
  "properties": {
    "id": {
      "type": "string",
      "pattern": "^[a-z0-9][a-z0-9-]*$",
      "description": "Stable identifier. SHOULD match the file name (without .json)."
    },
    "title": {
      "type": "string",
      "description": "One-line summary of what this case asserts."
    },
    "description": {
      "type": "string",
      "description": "Optional longer prose. Cite the specific spec ambiguity or requirement this case pins down."
    },
    "spec_refs": {
      "type": "array",
      "items": { "type": "string" },
      "description": "Section refs into the v0.1 specs (trajectory.md, commission.md, agent-descriptor.md, resolver.md) or schema fragments this case verifies."
    },
    "applies_to": {
      "type": "array",
      "items": { "enum": ["agent", "supervisor"] },
      "minItems": 1,
      "description": "Which side(s) of the seam this case validates. Most cases test agent behavior given a scripted resolver; supervisor cases assert the supervisor produces conforming Commissions."
    },
    "commission": {
      "$ref": "https://raw.githubusercontent.com/portofcontext/agent-voyager-project/main/spec/commission/v0.1-beta/commission.schema.json"
    },
    "scripted_model": {
      "type": "array",
      "items": { "$ref": "#/$defs/ModelResponse" },
      "description": "One entry per turn the harness should serve in order. The harness's mock model returns these responses to the agent regardless of conversation history."
    },
    "scripted_tools": {
      "type": "object",
      "additionalProperties": { "$ref": "#/$defs/ToolResponse" },
      "description": "Map from tool name to the response the harness returns when that tool is called locally. Tools not listed here either fall through to a Commission-managed MCP server (when one is declared) or surface as tool_failed (unknown tool)."
    },
    "omit_resolver": {
      "type": "boolean",
      "default": false,
      "description": "When true, the harness skips wiring a ResolverDriver even if the Commission carries managed assets. Used to exercise the `resolver_not_configured` startup gate (spec/resolver/v0.1-beta/resolver.md §2)."
    },
    "scripted_resolver": {
      "type": "object",
      "additionalProperties": false,
      "description": "Configures the in-process ResolverDriver the harness wires when the Commission carries any managed assets. Cases that omit this with a non-empty Commission asset list exercise the managed_ref_resolve_failed path (every lookup misses).",
      "properties": {
        "resolutions": {
          "type": "object",
          "additionalProperties": { "$ref": "#/$defs/ResolveOutcome" },
          "description": "Maps lookup key → outcome. Key may be '<kind>:<id>' (e.g. 'mcp_server:github') or just '<id>' (matched across kinds for short cases). Matching value carries either {result: ...} for success or {error, error_code?} for the resolve-failed path."
        },
        "subagent_spawns": {
          "type": "object",
          "additionalProperties": { "$ref": "#/$defs/SubagentSpawnSpec" },
          "description": "Maps Commission.subagents[].id to a canned avp.spawn_subagent outcome. Only consulted when the model invokes a subagent at runtime."
        }
      }
    },
    "agent_descriptor": {
      "type": "object",
      "description": "Optional. AgentDescriptor the harness passes to AVPAgent so it emits the run_requested + agent_described prelude. Cases that don't set this exercise the no-prelude path (the agent skips emission and the trajectory looks the same as before this field existed). The value is validated as a Pydantic AgentDescriptor at run time.",
      "additionalProperties": true
    },
    "agent_builtin_tools": {
      "type": "array",
      "items": {
        "type": "object",
        "required": ["name", "description", "input_schema"],
        "additionalProperties": false,
        "properties": {
          "name": { "type": "string", "minLength": 1 },
          "description": { "type": "string" },
          "input_schema": { "type": "object", "additionalProperties": true }
        }
      },
      "description": "Optional. Declares the agent's built-in tool catalog so cases can exercise the agent-internal contribution to agent_started.tools[]. Each entry is a tool descriptor the agent exposes natively (e.g., bash, read_file)."
    },
    "expectations": {
      "type": "object",
      "required": ["events"],
      "additionalProperties": false,
      "properties": {
        "events": {
          "type": "array",
          "items": { "$ref": "#/$defs/EventMatcher" },
          "description": "Ordered patterns the trajectory must contain (see 'ordering')."
        },
        "ordering": {
          "enum": ["in_order_subsequence", "in_order_strict", "any_order"],
          "default": "in_order_subsequence",
          "description": "in_order_subsequence: matches must appear in this order, but unmatched events MAY interleave. in_order_strict: matches must be the entire trajectory in order, no extras. any_order: matches must each appear somewhere."
        },
        "forbidden_events": {
          "type": "array",
          "items": { "$ref": "#/$defs/EventMatcher" },
          "description": "Patterns that MUST NOT appear anywhere in the trajectory."
        },
        "final_state": { "$ref": "#/$defs/FinalState" }
      }
    }
  },

  "$defs": {
    "ModelResponse": {
      "type": "object",
      "required": ["tokens_input", "tokens_output", "cost_usd", "duration_ms"],
      "additionalProperties": false,
      "properties": {
        "tokens_input": { "type": "integer", "minimum": 0 },
        "tokens_output": { "type": "integer", "minimum": 0 },
        "cost_usd": { "type": "number", "minimum": 0 },
        "duration_ms": { "type": "integer", "minimum": 0 },
        "tokens_cache_read": { "type": "integer", "minimum": 0 },
        "tokens_cache_write": { "type": "integer", "minimum": 0 },
        "text": { "type": "string" },
        "tool_calls": {
          "type": "array",
          "items": {
            "type": "object",
            "required": ["call_id", "tool", "input"],
            "additionalProperties": false,
            "properties": {
              "call_id": { "type": "string" },
              "tool": { "type": "string" },
              "input": { "type": "object", "additionalProperties": true }
            }
          }
        },
        "reasoning_blocks": {
          "type": "array",
          "description": "Reasoning / thinking blocks the model produced this turn. Each becomes one avp.reasoning_emitted event.",
          "items": {
            "type": "object",
            "additionalProperties": false,
            "properties": {
              "text": { "type": "string" },
              "signature": { "type": "string" },
              "redacted": { "type": "boolean", "default": false }
            }
          }
        },
        "refusal": {
          "type": "object",
          "description": "When set, the agent emits avp.refusal_recorded and terminates with StopReason.refused. Universal across providers — `reason` is the provider's verbatim code (anthropic 'refusal'/'sensitive', openai 'content_filter', gemini 'SAFETY'/'BLOCKLIST'/etc.).",
          "required": ["reason"],
          "additionalProperties": false,
          "properties": {
            "reason": { "type": "string", "minLength": 1 },
            "message": { "type": "string" },
            "category": { "type": "string" },
            "provider": { "type": "string" }
          }
        },
        "converged": {
          "type": "boolean",
          "default": false,
          "description": "When true and tool_calls is empty, the agent should treat the response as terminal and stop with reason=converged."
        }
      }
    },
    "ToolResponse": {
      "oneOf": [
        {
          "type": "object",
          "required": ["output"],
          "additionalProperties": false,
          "properties": {
            "output": { "type": "string" },
            "duration_ms": { "type": "integer", "minimum": 0, "default": 1 }
          }
        },
        {
          "type": "object",
          "required": ["error"],
          "additionalProperties": false,
          "properties": {
            "error": { "type": "string" },
            "duration_ms": { "type": "integer", "minimum": 0, "default": 1 }
          }
        }
      ]
    },
    "ResolveOutcome": {
      "oneOf": [
        {
          "type": "object",
          "required": ["result"],
          "additionalProperties": false,
          "properties": {
            "result": {
              "description": "Material the resolver returns to the agent. Shape varies by kind (per spec/resolver/v0.1-beta/resolver.md §3).",
              "type": "object",
              "additionalProperties": true
            }
          }
        },
        {
          "type": "object",
          "required": ["error"],
          "additionalProperties": false,
          "properties": {
            "error": { "type": "string", "minLength": 1 },
            "error_code": { "type": "string" }
          }
        }
      ]
    },
    "SubagentSpawnSpec": {
      "type": "object",
      "additionalProperties": false,
      "description": "Canned outcome for one avp.spawn_subagent call, mirroring agent.drivers.SubagentSpawnOutcome. The harness emits subagent_invoked carrying child_run_id, then emits subagent_returned (or subagent_failed when `error` is set).",
      "properties": {
        "child_run_id": {
          "type": "string",
          "description": "Child run_id stamped on subagent_invoked.data['avp.subagent.run_id']. When omitted, the harness synthesizes a deterministic id."
        },
        "text": {
          "type": "string",
          "description": "Result text the subagent returned to the parent (becomes the parent's tool_result-equivalent)."
        },
        "structured": {
          "description": "Optional structured result (any JSON value). Surfaces on subagent_returned.data.avp.subagent.result.structured."
        },
        "reason": {
          "enum": ["converged", "error", "interrupted", "refused"],
          "default": "converged",
          "description": "How the subagent terminated; mirrors AVP StopReason."
        },
        "duration_ms": {
          "type": "integer",
          "minimum": 0,
          "default": 1
        },
        "usage": {
          "type": "object",
          "additionalProperties": false,
          "description": "Subagent's RunStateSnapshot rollup. Reflected on subagent_returned.data.avp.subagent.usage AND added to the parent's cumulative state.",
          "properties": {
            "total_cost_usd": { "type": "number", "minimum": 0 },
            "total_tokens":   { "type": "integer", "minimum": 0 },
            "total_turns":    { "type": "integer", "minimum": 0 },
            "tokens_input_total":  { "type": "integer", "minimum": 0 },
            "tokens_output_total": { "type": "integer", "minimum": 0 }
          }
        },
        "error": {
          "type": "string",
          "description": "When set, the harness emits subagent_failed instead of subagent_returned with this error message."
        },
        "error_code": {
          "type": "string",
          "description": "Optional stable error code accompanying `error`."
        }
      }
    },
    "EventMatcher": {
      "type": "object",
      "required": ["match"],
      "additionalProperties": false,
      "description": "Partial-match pattern. Every key/value in 'match' must appear in the event with that exact value (deep-equal for nested objects). Other keys MAY be present.",
      "properties": {
        "match": { "type": "object", "additionalProperties": true },
        "label": { "type": "string", "description": "Human-readable name for assertion failure messages." }
      }
    },
    "FinalState": {
      "type": "object",
      "additionalProperties": false,
      "properties": {
        "stop_reason": { "type": "string", "description": "Expected agent_stopped.reason." },
        "total_turns": { "type": "integer", "minimum": 0 },
        "min_total_cost_usd": { "type": "number", "minimum": 0 },
        "max_total_cost_usd": { "type": "number", "minimum": 0 },
        "min_total_tokens": { "type": "integer", "minimum": 0 },
        "max_total_tokens": { "type": "integer", "minimum": 0 }
      }
    }
  }
}
