{
  "id": "mcp-server-connected-disconnected-pair",
  "title": "Each Commission.mcp_servers entry MUST emit a connected event after resolution and a disconnected event before agent_stopped",
  "description": "When Commission.mcp_servers declares one or more managed servers, the agent MUST resolve each ref via avp.resolve at startup, emit managed_ref_resolved per ref, then emit avp.mcp_server_connected per server before any model turns runs, and avp.mcp_server_disconnected per server before agent_stopped. Each event carries avp.mcp.server_id matching the Commission entry's id. This is the lifecycle a supervisor relies on to know which MCP servers were actually wired up for the run.",
  "spec_refs": [
    "spec/trajectory/v0.1/trajectory.md#4-tool-dispatch",
    "spec/resolver/v0.1-beta/resolver.md"
  ],
  "applies_to": [
    "agent"
  ],
  "commission": {
    "schema_version": "0.1",
    "run_id": "mcp-lifecycle",
    "model": "test/mock",
    "mcp_servers": [
      {
        "id": "github",
        "ref": {
          "vault": "test",
          "key": "gh"
        }
      },
      {
        "id": "weather",
        "ref": "weather-mcp-v1"
      }
    ]
  },
  "agent_descriptor": {
    "agent_name": "test-agent",
    "agent_version": "0.0.0",
    "avp_spec_version": "0.1"
  },
  "scripted_resolver": {
    "resolutions": {
      "mcp_server:github": {
        "result": {
          "transport": "http",
          "url": "https://example.com/mcp/github"
        }
      },
      "mcp_server:weather": {
        "result": {
          "transport": "http",
          "url": "https://example.com/mcp/weather"
        }
      }
    }
  },
  "scripted_model": [
    {
      "tokens_input": 5,
      "tokens_output": 2,
      "cost_usd": 0.0001,
      "duration_ms": 1,
      "text": "ok",
      "converged": true
    }
  ],
  "expectations": {
    "ordering": "in_order_subsequence",
    "events": [
      {
        "match": {
          "type": "avp.agent_started",
          "subject": "mcp-lifecycle"
        }
      },
      {
        "match": {
          "type": "avp.managed_ref_resolved",
          "data": {
            "avp.managed.kind": "mcp_server",
            "avp.managed.id": "github"
          }
        }
      },
      {
        "match": {
          "type": "avp.managed_ref_resolved",
          "data": {
            "avp.managed.kind": "mcp_server",
            "avp.managed.id": "weather"
          }
        }
      },
      {
        "match": {
          "type": "avp.mcp_server_connected",
          "data": {
            "avp.mcp.server_id": "github"
          }
        }
      },
      {
        "match": {
          "type": "avp.mcp_server_connected",
          "data": {
            "avp.mcp.server_id": "weather"
          }
        }
      },
      {
        "match": {
          "type": "avp.model_turn_started"
        }
      },
      {
        "match": {
          "type": "avp.mcp_server_disconnected",
          "data": {
            "avp.mcp.server_id": "github"
          }
        }
      },
      {
        "match": {
          "type": "avp.mcp_server_disconnected",
          "data": {
            "avp.mcp.server_id": "weather"
          }
        }
      },
      {
        "match": {
          "type": "avp.agent_stopped",
          "data": {
            "avp.reason": "converged"
          }
        }
      }
    ]
  }
}
