{
  "id": "empty-allowlist-hides-all-builtins",
  "title": "Commission.enabled_builtin_tools=[] hides every built-in from the model surface",
  "description": "distinguishing absent (all enabled) from `[]` (none enabled) matters. With an empty allowlist, agent_started.data.tools[] MUST contain no built-ins of that kind. The agent still runs (text-only delegation flow); the model just sees no tools.",
  "spec_refs": [
    "spec/commission/v0.1-beta/commission.md#4-built-in-surface-allowlists"
  ],
  "applies_to": [
    "agent"
  ],
  "commission": {
    "schema_version": "0.1",
    "run_id": "empty-allowlist",
    "model": "test/mock",
    "enabled_builtin_tools": []
  },
  "agent_descriptor": {
    "agent_name": "test-agent",
    "agent_version": "0.0.0",
    "avp_spec_version": "0.1",
    "built_in_tools": [
      {
        "name": "Read"
      },
      {
        "name": "Bash"
      }
    ]
  },
  "agent_builtin_tools": [
    {
      "name": "Read",
      "description": "Read.",
      "input_schema": {
        "type": "object"
      }
    },
    {
      "name": "Bash",
      "description": "Bash.",
      "input_schema": {
        "type": "object"
      }
    }
  ],
  "scripted_model": [
    {
      "tokens_input": 5,
      "tokens_output": 1,
      "cost_usd": 0.0,
      "duration_ms": 1,
      "text": "no tools, just talking",
      "converged": true
    }
  ],
  "expectations": {
    "ordering": "in_order_subsequence",
    "events": [
      {
        "label": "agent_started.tools is null/empty when allowlist is []",
        "match": {
          "type": "avp.agent_started",
          "subject": "empty-allowlist"
        }
      },
      {
        "match": {
          "type": "avp.agent_stopped",
          "data": {
            "avp.reason": "converged"
          }
        }
      }
    ],
    "forbidden_events": [
      {
        "label": "no tool surfaces when allowlist is empty",
        "match": {
          "type": "avp.agent_started",
          "data": {
            "tools": [
              {
                "name": "Read"
              }
            ]
          }
        }
      }
    ]
  }
}
