{
  "id": "agent-started-tools-reflects-builtins",
  "title": "agent_started.data.tools[] surfaces every agent-built-in tool with avp.tool.dispatch_target=local",
  "description": "With the refs-only Commission, agent_started.data.tools[] is the agent-internal contribution to the unified tool bag: built-in tools the agent ships compiled into its package. Each entry MUST include `name` and SHOULD set `avp.dispatch_target` to `local`. MCP-server tools land separately on `mcp_server_connected.data.avp.mcp.tools[]` after resolution.",
  "spec_refs": [
    "spec/trajectory/v0.1/trajectory.md#4-tool-dispatch",
    "spec/trajectory/v0.1/trajectory.md#2-1-run-prelude"
  ],
  "applies_to": [
    "agent"
  ],
  "commission": {
    "schema_version": "0.1",
    "run_id": "tools-effective-surface",
    "model": "test/mock"
  },
  "agent_builtin_tools": [
    {
      "name": "read_file",
      "description": "Read a file from the workspace.",
      "input_schema": {
        "type": "object",
        "properties": {
          "path": {
            "type": "string"
          }
        },
        "required": [
          "path"
        ]
      }
    },
    {
      "name": "bash",
      "description": "Run a shell command.",
      "input_schema": {
        "type": "object",
        "properties": {
          "command": {
            "type": "string"
          }
        },
        "required": [
          "command"
        ]
      }
    }
  ],
  "scripted_model": [
    {
      "tokens_input": 12,
      "tokens_output": 4,
      "cost_usd": 0.0001,
      "duration_ms": 1,
      "text": "ok",
      "converged": true
    }
  ],
  "expectations": {
    "ordering": "in_order_subsequence",
    "events": [
      {
        "label": "agent_started lists both built-ins with dispatch_target=local",
        "match": {
          "type": "avp.agent_started",
          "data": {
            "tools": [
              {
                "name": "read_file",
                "description": "Read a file from the workspace.",
                "avp.dispatch_target": "local"
              },
              {
                "name": "bash",
                "description": "Run a shell command.",
                "avp.dispatch_target": "local"
              }
            ]
          }
        }
      },
      {
        "match": {
          "type": "avp.agent_stopped",
          "data": {
            "avp.reason": "converged"
          }
        }
      }
    ]
  }
}
