{
  "id": "source-agent-events-tagged-agent",
  "title": "Every agent-emitted event in a baseline run carries source='agent'",
  "description": "Source-field discipline. Without supervisor messages, every event in the trajectory MUST be tagged source='agent'. No event MAY be missing the source field, and no agent-emitted event MAY be tagged source='supervisor'.",
  "spec_refs": [
    "spec/trajectory/v0.1/trajectory.md",
    "spec/avp.schema.json#/$defs/EventBase"
  ],
  "applies_to": [
    "agent"
  ],
  "commission": {
    "schema_version": "0.1",
    "run_id": "source-agent-baseline",
    "model": "test/mock"
  },
  "scripted_model": [
    {
      "tokens_input": 10,
      "tokens_output": 5,
      "cost_usd": 0.001,
      "duration_ms": 1,
      "text": "done",
      "converged": true
    }
  ],
  "expectations": {
    "events": [
      {
        "match": {
          "type": "avp.agent_started",
          "source": "avp://agent"
        }
      },
      {
        "match": {
          "type": "avp.model_turn_started",
          "source": "avp://agent"
        }
      },
      {
        "match": {
          "type": "avp.model_turn_ended",
          "source": "avp://agent"
        }
      },
      {
        "match": {
          "type": "avp.cost_recorded",
          "source": "avp://agent"
        }
      },
      {
        "match": {
          "type": "avp.agent_stopped",
          "source": "avp://agent"
        }
      }
    ],
    "forbidden_events": [
      {
        "label": "no agent-emitted event may carry source=supervisor in a baseline run",
        "match": {
          "source": "avp://supervisor"
        }
      }
    ]
  }
}
